{
  "$schema": "https://json-schema.org/draft/2020-12/schema",
  "$id": "https://ait.example/schemas/ait-transcript-credential.v1_1.schema.json",
  "title": "AIT Student Academic Transcript (AitTranscriptCredential), VCDM 1.1",
  "description": "The AIT Student Academic Transcript as a W3C Verifiable Credential, Data Model 1.1, JSON-LD (ldp_vc). It is the 1.1 counterpart of ait-transcript-credential.schema.json (Data Model 2.0), which is what the transcript demo issues today. Differences from the 2.0 schema: the base context is https://www.w3.org/2018/credentials/v1, the dates are issuanceDate and expirationDate, and there is no credentialStatus, because Inji Certify 0.14 attaches a status entry only to a 2.0 credential. The proof is one of two suites Certify 0.14 can emit: Ed25519Signature2020 (multibase proofValue) or Ed25519Signature2018 (detached JWS in proof.jws). credentialSubject is unchanged: all values are strings, because Certify fills a text template; dates are ISO 8601 (YYYY-MM-DD) and numbers are decimal strings. See ait-transcript-credential.v1_1.example.json and ait-transcript-credential.v1_1.jws.example.json.",
  "type": "object",
  "required": ["@context", "id", "type", "issuer", "issuanceDate", "expirationDate", "credentialSubject", "proof"],
  "properties": {
    "@context": {
      "description": "JSON-LD contexts: VCDM 1.1, then the AIT transcript vocabulary (terms under https://ait.example/transcript#). A credential signed with Ed25519Signature2020 adds that suite's context as a third entry; Ed25519Signature2018 needs none, because the 1.1 context defines it. The transcript context URL is internal to the demo stack.",
      "type": "array",
      "prefixItems": [
        { "const": "https://www.w3.org/2018/credentials/v1" },
        { "type": "string", "description": "AIT transcript context, e.g. http://certify-nginx/academic-transcript-context.json" }
      ],
      "minItems": 2,
      "items": { "type": "string" }
    },
    "id": {
      "description": "Credential identifier: https://ait.example/credential/ followed by a UUID.",
      "type": "string",
      "format": "uri",
      "pattern": "^https://ait\\.example/credential/"
    },
    "type": {
      "type": "array",
      "items": { "type": "string" },
      "allOf": [
        { "contains": { "const": "VerifiableCredential" } },
        { "contains": { "const": "AitTranscriptCredential" } }
      ]
    },
    "issuer": {
      "description": "The AIT University Registrar's DID (did:key in the demo; its public key is the DID itself).",
      "type": "string",
      "pattern": "^did:"
    },
    "issuanceDate": {
      "description": "Issuance time of this credential (UTC). Named validFrom in the 2.0 schema.",
      "type": "string",
      "format": "date-time"
    },
    "expirationDate": {
      "description": "Expiry of this credential (UTC). Named validUntil in the 2.0 schema. The demo issuer sets two years after issuanceDate.",
      "type": "string",
      "format": "date-time"
    },
    "credentialSubject": { "$ref": "#/$defs/transcript" },
    "proof": {
      "description": "Issuer signature over the credential, canonicalized with URDNA2015.",
      "oneOf": [
        { "$ref": "#/$defs/proofEd25519Signature2020" },
        { "$ref": "#/$defs/proofEd25519Signature2018" }
      ]
    }
  },
  "allOf": [
    {
      "if": {
        "required": ["proof"],
        "properties": { "proof": { "required": ["type"], "properties": { "type": { "const": "Ed25519Signature2020" } } } }
      },
      "then": {
        "properties": { "@context": { "contains": { "const": "https://w3id.org/security/suites/ed25519-2020/v1" } } }
      }
    }
  ],
  "$defs": {
    "date": { "type": "string", "pattern": "^[0-9]{4}-[0-9]{2}-[0-9]{2}$" },
    "decimal": { "type": "string", "pattern": "^[0-9]+(\\.[0-9]+)?$" },
    "proofEd25519Signature2020": {
      "title": "Ed25519Signature2020 (the suite the demo stack signs with today)",
      "type": "object",
      "required": ["type", "created", "proofPurpose", "verificationMethod", "proofValue"],
      "properties": {
        "type": { "const": "Ed25519Signature2020" },
        "created": { "type": "string", "format": "date-time" },
        "proofPurpose": { "const": "assertionMethod" },
        "verificationMethod": { "type": "string", "description": "Issuer DID URL of the signing key." },
        "proofValue": { "type": "string", "pattern": "^z", "description": "Multibase (base58btc) Ed25519 signature." }
      }
    },
    "proofEd25519Signature2018": {
      "title": "Ed25519Signature2018 (JWS-based proof)",
      "type": "object",
      "required": ["type", "created", "proofPurpose", "verificationMethod", "jws"],
      "properties": {
        "type": { "const": "Ed25519Signature2018" },
        "created": { "type": "string", "format": "date-time" },
        "proofPurpose": { "const": "assertionMethod" },
        "verificationMethod": { "type": "string", "description": "Issuer DID URL of the signing key." },
        "jws": {
          "description": "Detached JWS (RFC 7515 with RFC 7797 unencoded payload): <protected header>..<signature>. The header carries alg EdDSA and b64 false; the payload is omitted.",
          "type": "string",
          "pattern": "^[A-Za-z0-9_-]+\\.\\.[A-Za-z0-9_-]+$"
        }
      }
    },
    "transcript": {
      "title": "Transcript subject (the student and the degree)",
      "type": "object",
      "required": [
        "id", "fullName", "dateOfBirth", "country", "registrationNo", "previousDegree", "yearAwarded",
        "dateAdmitted", "option", "degreeAwarded", "dateGraduation", "faculty", "academicProgram",
        "areaOfSpecialization", "notes", "issueDate", "courses", "courseTableHtml", "courseList",
        "thesisTitle", "thesisGrade", "programCommittee", "courseworkCredits", "thesisCredits",
        "totalCredits", "thesisExamination"
      ],
      "properties": {
        "id": {
          "description": "The holder: the student's wallet key as a did:jwk (bound at issuance). Not a student number.",
          "type": "string",
          "pattern": "^did:jwk:"
        },
        "fullName": {
          "description": "Student's full name as one string (not split into given, middle and family names), e.g. \"Sila N Mahoot\".",
          "type": "string"
        },
        "dateOfBirth": { "description": "Date of birth.", "$ref": "#/$defs/date" },
        "country": {
          "description": "Student's country, as a name (not an ISO code), e.g. \"Thailand\".",
          "type": "string"
        },
        "registrationNo": {
          "description": "AIT student number for this degree, e.g. \"st125001\". A student with two degrees has two numbers and two transcripts.",
          "type": "string"
        },
        "previousDegree": {
          "description": "Previous degree and awarding institution, free text, e.g. \"B.Eng Computer Engineering, Kasetsart University\".",
          "type": "string"
        },
        "yearAwarded": { "description": "Year the previous degree was awarded (YYYY).", "type": "string", "pattern": "^[0-9]{4}$" },
        "dateAdmitted": { "description": "Date admitted to AIT for this degree.", "$ref": "#/$defs/date" },
        "option": { "description": "Programme option, e.g. \"Thesis\".", "type": "string" },
        "degreeAwarded": { "description": "Degree name, e.g. \"Master of Engineering\", \"Doctor of Philosophy\".", "type": "string" },
        "dateGraduation": { "description": "Graduation date.", "$ref": "#/$defs/date" },
        "faculty": { "description": "School (faculty) name, e.g. \"School of Engineering and Technology\".", "type": "string" },
        "academicProgram": { "description": "Programme name, e.g. \"M.Eng Computer Science\".", "type": "string" },
        "areaOfSpecialization": { "description": "Area of specialization, e.g. \"Distributed Systems\".", "type": "string" },
        "notes": { "description": "Remarks on the transcript; \"-\" when there are none.", "type": "string" },
        "issueDate": { "description": "Issue date printed on the transcript (the document's date, not the credential's issuanceDate).", "$ref": "#/$defs/date" },
        "courses": {
          "description": "The course record, one entry per semester (term), in order. This is the structured source of the transcript's course table.",
          "type": "array",
          "items": { "$ref": "#/$defs/term" }
        },
        "courseTableHtml": {
          "description": "Presentation only: the course table pre-rendered as HTML for the PDF. Same content as courses plus the credit totals; not intended for mapping.",
          "type": "string"
        },
        "courseList": {
          "description": "Presentation only: one line per course, \"<title> — <grade>\", lines separated by \\n. Derived from courses.",
          "type": "string"
        },
        "thesisTitle": { "description": "Thesis title.", "type": "string" },
        "thesisGrade": { "description": "Thesis grade, e.g. \"A\".", "type": "string" },
        "programCommittee": {
          "description": "Programme (thesis) committee members, one per line (lines separated by \\n), chair first with \"(Chair)\".",
          "type": "string"
        },
        "courseworkCredits": { "description": "Total coursework credits, e.g. \"27.0\".", "$ref": "#/$defs/decimal" },
        "thesisCredits": { "description": "Thesis credits, e.g. \"22.0\".", "$ref": "#/$defs/decimal" },
        "totalCredits": { "description": "Total credits (coursework + thesis), e.g. \"49.0\".", "$ref": "#/$defs/decimal" },
        "thesisExamination": { "description": "Thesis examination result, e.g. \"Passed\".", "type": "string" }
      }
    },
    "term": {
      "title": "Semester",
      "type": "object",
      "required": ["term", "courses", "credits", "gpa", "cumGpa"],
      "properties": {
        "term": { "description": "Semester name, e.g. \"August Semester 2024\".", "type": "string" },
        "courses": { "type": "array", "items": { "$ref": "#/$defs/course" } },
        "credits": { "description": "Credits taken in this semester.", "$ref": "#/$defs/decimal" },
        "gpa": { "description": "Semester GPA (4.00 scale).", "$ref": "#/$defs/decimal" },
        "cumGpa": { "description": "Cumulative GPA at the end of this semester.", "$ref": "#/$defs/decimal" }
      }
    },
    "course": {
      "title": "Course taken",
      "type": "object",
      "required": ["no", "title", "lec", "lab", "credits", "grade"],
      "properties": {
        "no": { "description": "Course code, e.g. \"CS601\".", "type": "string" },
        "title": { "description": "Course title.", "type": "string" },
        "lec": { "description": "Lecture hours.", "$ref": "#/$defs/decimal" },
        "lab": { "description": "Lab hours.", "$ref": "#/$defs/decimal" },
        "credits": { "description": "Credits.", "$ref": "#/$defs/decimal" },
        "grade": { "description": "Letter grade, e.g. \"A\", \"B+\".", "type": "string" }
      }
    }
  }
}
