{
  "@context": [
    "https://www.w3.org/2018/credentials/v1",
    "http://certify-nginx/academic-transcript-context.json",
    "https://w3id.org/security/suites/ed25519-2020/v1"
  ],
  "id": "https://ait.example/credential/dcd68410-875b-48d7-9c83-d2eee3bece5f",
  "type": [
    "VerifiableCredential",
    "AitTranscriptCredential"
  ],
  "issuer": "did:key:z6MkqFYtP99jdVRu18ms6eG9ho8Qm2aHenkjPn6uQLUsGtU7",
  "issuanceDate": "2026-10-01T09:00:00.000Z",
  "expirationDate": "2028-09-30T09:00:00.000Z",
  "credentialSubject": {
    "id": "did:jwk:eyJrdHkiOiJFQyIsInVzZSI6InNpZyIsImNydiI6IlAtMjU2IiwieCI6ImwyRWZ6MEZabXdDTEpEeU54Nl8yQlNQSjBEaXNXOUNwTWxIR3lNYkVzekkiLCJ5IjoiMmEzWnBOZXB3MDVPUlgyRjZhQktNamltQkF2TjZuS3h5a1Zxa3JIWTM2dyIsImFsZyI6IkVTMjU2In0=",
    "fullName": "Sila N Mahoot",
    "dateOfBirth": "1998-04-12",
    "country": "Thailand",
    "registrationNo": "st125001",
    "previousDegree": "B.Eng Computer Engineering, Kasetsart University",
    "yearAwarded": "2023",
    "dateAdmitted": "2024-08-19",
    "option": "Thesis",
    "degreeAwarded": "Master of Engineering",
    "dateGraduation": "2026-08-31",
    "faculty": "School of Engineering and Technology",
    "academicProgram": "M.Eng Computer Science",
    "areaOfSpecialization": "Distributed Systems",
    "notes": "-",
    "issueDate": "2026-09-17",
    "courses": [
      {
        "term": "August Semester 2024",
        "courses": [
          {
            "no": "CS601",
            "title": "Advanced Algorithms",
            "lec": "45",
            "lab": "0",
            "credits": "3",
            "grade": "A"
          },
          {
            "no": "CS602",
            "title": "Machine Learning",
            "lec": "30",
            "lab": "45",
            "credits": "3",
            "grade": "A-"
          },
          {
            "no": "CS603",
            "title": "Distributed Systems",
            "lec": "30",
            "lab": "45",
            "credits": "3",
            "grade": "B+"
          }
        ],
        "credits": "9",
        "gpa": "3.67",
        "cumGpa": "3.67"
      },
      {
        "term": "January Semester 2025",
        "courses": [
          {
            "no": "CS604",
            "title": "Computer Vision",
            "lec": "30",
            "lab": "45",
            "credits": "3",
            "grade": "A"
          },
          {
            "no": "CS605",
            "title": "Cryptography and Network Security",
            "lec": "45",
            "lab": "0",
            "credits": "3",
            "grade": "A"
          },
          {
            "no": "CS606",
            "title": "Cloud Computing",
            "lec": "30",
            "lab": "45",
            "credits": "3",
            "grade": "A-"
          }
        ],
        "credits": "9",
        "gpa": "3.89",
        "cumGpa": "3.78"
      }
    ],
    "courseTableHtml": "<table style=\"width:100%;border-collapse:collapse;font-size:10px;font-family:'Arial Narrow',Arial,Helvetica,sans-serif;border:1px solid #000;margin:0;margin-top:-1px;\"><thead><tr><th style=\"padding:2px 4px;border:none;font-weight:700;\">Course No.</th><th style=\"padding:2px 4px;border:none;font-weight:700;\">Descriptive Course Title</th><th style=\"padding:2px 4px;border:none;font-weight:700;\">Lab.</th><th style=\"padding:2px 4px;border:none;font-weight:700;\">Lec.</th><th style=\"padding:2px 4px;border:none;font-weight:700;\">Credits</th><th style=\"padding:2px 4px;border:none;font-weight:700;\">Grade</th><th style=\"padding:2px 4px;border:none;font-weight:700;\">GPA</th><th style=\"padding:2px 4px;border:none;font-weight:700;\">Cumul. GPA</th></tr></thead><tbody><tr><td colspan=\"8\" style=\"text-align:center;font-weight:700;padding:2px 4px;border:none;\">August Semester 2024</td></tr><tr><td style=\"padding:2px 4px;border:none;text-align:center;\">CS601</td><td style=\"padding:2px 4px;border:none;text-align:left;\">Advanced Algorithms</td><td style=\"padding:2px 4px;border:none;text-align:center;\">0</td><td style=\"padding:2px 4px;border:none;text-align:center;\">45</td><td style=\"padding:2px 4px;border:none;text-align:center;\">3</td><td style=\"padding:2px 4px;border:none;text-align:center;\">A</td><td style=\"padding:2px 4px;border:none;text-align:center;\"></td><td style=\"padding:2px 4px;border:none;text-align:center;\"></td></tr><tr><td style=\"padding:2px 4px;border:none;text-align:center;\">CS602</td><td style=\"padding:2px 4px;border:none;text-align:left;\">Machine Learning</td><td style=\"padding:2px 4px;border:none;text-align:center;\">45</td><td style=\"padding:2px 4px;border:none;text-align:center;\">30</td><td style=\"padding:2px 4px;border:none;text-align:center;\">3</td><td style=\"padding:2px 4px;border:none;text-align:center;\">A-</td><td style=\"padding:2px 4px;border:none;text-align:center;\"></td><td style=\"padding:2px 4px;border:none;text-align:center;\"></td></tr><tr><td style=\"padding:2px 4px;border:none;text-align:center;\">CS603</td><td style=\"padding:2px 4px;border:none;text-align:left;\">Distributed Systems</td><td style=\"padding:2px 4px;border:none;text-align:center;\">45</td><td style=\"padding:2px 4px;border:none;text-align:center;\">30</td><td style=\"padding:2px 4px;border:none;text-align:center;\">3</td><td style=\"padding:2px 4px;border:none;text-align:center;\">B+</td><td style=\"padding:2px 4px;border:none;text-align:center;\">3.67</td><td style=\"padding:2px 4px;border:none;text-align:center;\">3.67</td></tr><tr><td colspan=\"4\" style=\"padding:2px 4px;border:none;\"></td><td style=\"padding:2px 4px;border:none;text-align:center;\">9</td><td style=\"padding:2px 4px;border:none;\"></td><td style=\"padding:2px 4px;border:none;text-align:center;\">3.67</td><td style=\"padding:2px 4px;border:none;text-align:center;\">3.67</td></tr><tr><td colspan=\"8\" style=\"text-align:center;font-weight:700;padding:2px 4px;border:none;\">January Semester 2025</td></tr><tr><td style=\"padding:2px 4px;border:none;text-align:center;\">CS604</td><td style=\"padding:2px 4px;border:none;text-align:left;\">Computer Vision</td><td style=\"padding:2px 4px;border:none;text-align:center;\">45</td><td style=\"padding:2px 4px;border:none;text-align:center;\">30</td><td style=\"padding:2px 4px;border:none;text-align:center;\">3</td><td style=\"padding:2px 4px;border:none;text-align:center;\">A</td><td style=\"padding:2px 4px;border:none;text-align:center;\"></td><td style=\"padding:2px 4px;border:none;text-align:center;\"></td></tr><tr><td style=\"padding:2px 4px;border:none;text-align:center;\">CS605</td><td style=\"padding:2px 4px;border:none;text-align:left;\">Cryptography and Network Security</td><td style=\"padding:2px 4px;border:none;text-align:center;\">0</td><td style=\"padding:2px 4px;border:none;text-align:center;\">45</td><td style=\"padding:2px 4px;border:none;text-align:center;\">3</td><td style=\"padding:2px 4px;border:none;text-align:center;\">A</td><td style=\"padding:2px 4px;border:none;text-align:center;\"></td><td style=\"padding:2px 4px;border:none;text-align:center;\"></td></tr><tr><td style=\"padding:2px 4px;border:none;text-align:center;\">CS606</td><td style=\"padding:2px 4px;border:none;text-align:left;\">Cloud Computing</td><td style=\"padding:2px 4px;border:none;text-align:center;\">45</td><td style=\"padding:2px 4px;border:none;text-align:center;\">30</td><td style=\"padding:2px 4px;border:none;text-align:center;\">3</td><td style=\"padding:2px 4px;border:none;text-align:center;\">A-</td><td style=\"padding:2px 4px;border:none;text-align:center;\">3.89</td><td style=\"padding:2px 4px;border:none;text-align:center;\">3.78</td></tr><tr><td colspan=\"4\" style=\"padding:2px 4px;border:none;\"></td><td style=\"padding:2px 4px;border:none;text-align:center;\">9</td><td style=\"padding:2px 4px;border:none;\"></td><td style=\"padding:2px 4px;border:none;text-align:center;\">3.89</td><td style=\"padding:2px 4px;border:none;text-align:center;\">3.78</td></tr><tr><td colspan=\"8\" style=\"padding:0;border:none;height:113.9mm;\">&nbsp;</td></tr><tr><td colspan=\"5\" style=\"padding:2px 4px;border:none;\">Coursework Credits Gained</td><td colspan=\"3\" style=\"padding:2px 4px;border:none;\">27.0</td></tr><tr><td colspan=\"5\" style=\"padding:2px 4px;border:none;\">Thesis Credits Gained</td><td colspan=\"3\" style=\"padding:2px 4px;border:none;\">22.0</td></tr><tr><td colspan=\"5\" style=\"padding:2px 4px;border:none;\">Total Number of Credits Gained</td><td colspan=\"3\" style=\"padding:2px 4px;border:none;\">49.0</td></tr><tr><td colspan=\"5\" style=\"padding:2px 4px;border:none;\">Thesis Examination</td><td colspan=\"3\" style=\"padding:2px 4px;border:none;\">Passed</td></tr></tbody></table>",
    "courseList": "Advanced Algorithms — A\nMachine Learning — A-\nDistributed Systems — B+\nComputer Vision — A\nCryptography and Network Security — A\nCloud Computing — A-",
    "thesisTitle": "Verifiable Credential Issuance for Federated Academic Records",
    "thesisGrade": "A",
    "programCommittee": "Prof. Kittipong Wongsathan (Chair)\nDr. Nathas Tirawattanakul\nDr. Priya Ramaswamy",
    "courseworkCredits": "27.0",
    "thesisCredits": "22.0",
    "totalCredits": "49.0",
    "thesisExamination": "Passed"
  },
  "proof": {
    "type": "Ed25519Signature2020",
    "created": "2026-10-01T09:00:00Z",
    "proofPurpose": "assertionMethod",
    "verificationMethod": "did:key:z6MkqFYtP99jdVRu18ms6eG9ho8Qm2aHenkjPn6uQLUsGtU7#z6MkqFYtP99jdVRu18ms6eG9ho8Qm2aHenkjPn6uQLUsGtU7",
    "proofValue": "z5rvabSowc6brfNtatb3aYfbStjmBzjHjCj4PJsceyZ6Q5Mncy84pQHxBN5KafLdEnZd66ByHgHjNsDVngjtKrSkU"
  }
}
